{
  "$schema": "http://json-schema.org/draft-07/schema#",
  "$id": "https://boardgame-protocol.github.io/json-schemas/schemas/1.0.0/responses/get_matches.json",
  "type": "object",
  "required": [
    "version",
    "type",
    "agent_id",
    "matches"
  ],
  "properties": {
    "version": {
      "type": "string",
      "pattern": "^\\d+\\.\\d+\\.\\d+$"
    },
    "type": {
      "type": "string",
      "const": "get_matches_response"
    },
    "agent_id": {
      "type": "string"
    },
    "matches": {
      "type": "array",
      "items": {
        "type": "object",
        "required": [
          "match_id",
          "agents",
          "status"
        ],
        "properties": {
          "match_id": {
            "type": "string"
          },
          "agents": {
            "type": "array",
            "items": {
              "type": "object",
              "required": [
                "id",
                "name"
              ],
              "properties": {
                "id": {
                  "type": "string"
                },
                "name": {
                  "type": "string"
                }
              }
            },
            "minItems": 1
          },
          "status": {
            "type": "string",
            "enum": [
              "waiting",
              "started",
              "ended"
            ]
          }
        }
      }
    }
  },
  "additionalProperties": false
}